{
  "schema_version": 1,
  "job_id": "job:icml:2026:codex:001",
  "completed_at": "2026-07-13T15:00:00Z",
  "status": "patch_proposed",
  "failure_fingerprint": "cccccccccccccccccccccccccccccccccccccccccccccccccccccccccccccccc",
  "summary": "A saved fixture demonstrates a changed page selector.",
  "branch": "automation/icml-2026-selector",
  "worktree": "/tmp/openpapers-worktrees/icml-2026-selector",
  "changed_files": ["scrapers/icml.py", "tests/fixtures/icml-2026.html"],
  "tests": [
    {
      "command": "python -m unittest discover -s tests -v",
      "status": "passed",
      "exit_code": 0
    }
  ],
  "patch_artifact_id": "patch:icml:2026:001",
  "requires_human_review": true,
  "recursive_triggered": false,
  "merged": false,
  "deployed": false
}
